{
  "schema_version": 1,
  "entry_id": "kb_tw_harbor_market_square_event",
  "entry_type": "event",
  "canonical_name": "Market Square Inquiry",
  "status": "confirmed",
  "body": {
    "summary": "Mira asks dockhands and chart vendors in the market square for leads on the cartographer's guild.",
    "tags": ["story-beat", "inquiry"]
  },
  "revision": 1,
  "created_at": "2026-07-23T06:30:00Z",
  "updated_at": "2026-07-23T06:30:00Z",
  "extensions": {
    "nexus": {
      "world_id": "wld_toy_nexus_001"
    }
  }
}
