{"schema_version":1,"entry_id":"kb_tw_mira_private_shoal","entry_type":"info_point","canonical_name":"Mira's Undeclared Shoal Reading","status":"provisional","owner":"kb_tw_mira","disclosure":"owner-private","body":{"summary":"Mira's chart of the outer quay omits a shoal she sounded at dawn; the customs gate inspected a version without it. Only Mira holds this reading until she decides what it is worth.","tags":["pov","secret"]},"revision":1,"created_at":"2026-07-23T06:45:00Z","updated_at":"2026-07-23T06:45:00Z","extensions":{"nexus":{"world_id":"wld_toy_nexus_001"}}}
