{
  "schema_version": 1,
  "entry_id": "kb_tw_harbor_berth_confirm_event",
  "entry_type": "event",
  "canonical_name": "Berth Confirmation",
  "status": "confirmed",
  "body": {
    "summary": "Mira compares her mooring assignment against the harbor map — the berth remains unverified against official charts.",
    "tags": ["story-beat", "setup"]
  },
  "revision": 1,
  "created_at": "2026-07-23T08:00:00Z",
  "updated_at": "2026-07-23T08:00:00Z",
  "extensions": {
    "nexus": {
      "world_id": "wld_toy_nexus_001"
    }
  }
}
