{
  "schema_version": 1,
  "entry_id": "kb_tw_mira",
  "entry_type": "character",
  "canonical_name": "Mira Vale",
  "status": "confirmed",
  "body": {
    "summary": "Reluctant cartographer who charts coastal towns.",
    "tags": ["pov", "protagonist"],
    "attributes": [
      { "trait_type": "role", "value": "protagonist" },
      { "trait_type": "age", "value": 28, "display_type": "number" }
    ]
  },
  "source_anchor": {
    "schema_version": 1,
    "source_id": "manuscript:tw-ch1",
    "span": { "start": 48, "end": 312 },
    "label": "Harbor arrival scene",
    "extensions": {}
  },
  "revision": 1,
  "created_at": "2026-07-23T06:00:00Z",
  "updated_at": "2026-07-23T06:30:00Z",
  "extensions": {
    "nexus": {
      "world_id": "wld_toy_nexus_001",
      "fork_hint": "baseline"
    },
    "creader": {
      "book_id": "bk_toy_creader_001",
      "chapter_slug": "harbor-arrival"
    }
  }
}
